{"$schema":"https://json-schema.org/draft/2020-12/schema","type":"object","additionalProperties":false,"required":["schema_version","status","current_freeze","tier_definition","model_freeze_requirements","model_selection_slots","evidence_arms","design","cell_manifest","source_binding","estimands","analysis_rules","leakage_controls","non_estimability","controls"],"properties":{"schema_version":{"const":"translation-model-tier-plan-v1"},"status":{"const":"prospective_planning_only_new_freeze_required"},"current_freeze":{"type":"object","required":["freeze_id","empirical_change","execution_authorized","rule"]},"tier_definition":{"type":"object","required":["basis","tiers","undisclosed_policy"]},"model_freeze_requirements":{"type":"array","minItems":13},"model_selection_slots":{"type":"array","minItems":4,"maxItems":4},"evidence_arms":{"type":"array","minItems":4,"maxItems":4},"design":{"type":"object"},"cell_manifest":{"type":"array","minItems":12,"maxItems":12,"uniqueItems":true},"source_binding":{"type":"object"},"estimands":{"type":"array","minItems":10},"analysis_rules":{"type":"object"},"leakage_controls":{"type":"array","minItems":7},"non_estimability":{"type":"array","minItems":4},"controls":{"type":"object"}}}
