{
  "schema_version":"translation-model-tier-plan-v1",
  "status":"prospective_planning_only_new_freeze_required",
  "current_freeze":{"freeze_id":"g3-option-b-es-ja-20260812-v1","empirical_change":false,"execution_authorized":false,"rule":"This plan does not amend the existing Spanish/Japanese freeze. Exact models, prompts, evidence, sampling, repetitions and analysis code require a new freeze."},
  "tier_definition":{"basis":"prospective active-parameter bands, not universal quality claims; MoE total parameters recorded separately","tiers":[{"id":"tiny","active_parameters":"greater than 0 and at most 3B","role":"low-cost lexical and retrieval-conditioned baseline"},{"id":"small","active_parameters":"greater than 3B and at most 10B","role":"multilingual candidate generation and simple evidence synthesis"},{"id":"medium","active_parameters":"greater than 10B and at most 35B","role":"mapping-aware synthesis and conflict handling"},{"id":"large","active_parameters":"greater than 35B","role":"complex semantic discrimination and evidence integration"}],"undisclosed_policy":"Models without disclosed active parameter counts are supplementary size_unclassified and excluded from the four-tier primary contrast."},
  "model_freeze_requirements":["tier ID and definition version","provider and exact model ID","immutable weights revision or endpoint version","weights hash or unavailable reason","architecture and active/total parameters","quantization","context window and tokenizer revision","licence and data-handling locality","runtime/container/hardware","temperature top-p seed reasoning and output limits","system/task prompt and output-schema hashes","retrieval version and evidence rendering hash","timeout retry and pricing schedule","contamination declaration and availability receipt"],
  "model_selection_slots":[{"tier_id":"tiny","selection_status":"unselected_pending_new_freeze","exact_model":null},{"tier_id":"small","selection_status":"unselected_pending_new_freeze","exact_model":null},{"tier_id":"medium","selection_status":"unselected_pending_new_freeze","exact_model":null},{"tier_id":"large","selection_status":"unselected_pending_new_freeze","exact_model":null}],
  "evidence_arms":[{"id":"E0_model_only","generation_allowed":true,"authorized_payloads_required":false,"description":"English HPO record and permitted structural context; no translated lexical evidence"},{"id":"E1_translation_assisted","generation_allowed":true,"authorized_payloads_required":true,"description":"E0 plus eligible U2 existing translation atoms, exact-language and lineage-deduplicated"},{"id":"E2_lineage_ontology_assisted","generation_allowed":true,"authorized_payloads_required":true,"description":"E1 plus predicate-, direction-, semantic-loss- and rights-safe mapping and structural evidence"},{"id":"R0_withheld_existing_hpo_translation","generation_allowed":false,"authorized_payloads_required":true,"reference_reveal":"after_candidate_lock","description":"Exact existing Spanish/Japanese HPO translation comparator, withheld from generators and panel until lock"}],
  "design":{"cells":"four tiers crossed with E0 E1 and E2; R0 non-generative comparator per concept-language unit","randomization":"concept-blocked; paired seeds and evidence-order permutations; opaque condition IDs","blinding":"panel sees no tier arm provider source or generator identity","common_context":"primary uses smallest supported frozen context budget and identical canonical atoms","native_context":"separate sensitivity analysis","repetitions":"three independently seeded calls per tier-arm-unit in Stage 1 and pilot; five on frozen reliability subset","failures":"all calls, invalid outputs and failures retained in randomized reproducibility cost and nonacceptance denominators"},
  "cell_manifest":["tiny_E0","tiny_E1","tiny_E2","small_E0","small_E1","small_E2","medium_E0","medium_E1","medium_E2","large_E0","large_E1","large_E2"],
  "source_binding":{"eligible_assignments":["F02_mondo_ja_context","F03_umls_es_ja_discovery","F04_mesh_decs_es_lexical","F05_snomed_es_ja_context","F06_structural_upheno_mp","F07_ncit_context","F08_nando_ja_context","F09_orphanet_context","F10_regional_canada","F11_unmapped_supplementary","F12_disease_aggregates"],"rule":"Only assignments whose exact payload, language, edition, route, purpose, rights and new-freeze gates close may enter E1 or E2; weakest gate controls.","existing_translation":"F01_withheld_hpo_reference supplies R0 only and may not enter same-item generation."},
  "estimands":["within-tier E1 minus E0 and E2 minus E0 evidence effects","within-arm tier contrasts against large","tier-by-evidence interaction","each generative cell versus R0 without treating R0 as ground truth","clinically significant error and zero-edit acceptance","edit burden and semantic discrimination","calibration and lineage-deduplicated yield","latency tokens calls retries energy proxy and pinned-price cost","between-run stability and worst-run safety","leave-one-lineage-out ablation","quality-safety-cost Pareto frontier"],
  "analysis_rules":{"language":"Spanish and Japanese reported separately; no pooled sparse-cell rescue","primary_factorial_model":"tier, evidence arm, tier-by-arm interaction, language and language interactions; concept random intercept; repetition nested within cell","tier_order":"categorical primary; ordinal trend secondary only","model_nesting":"multiple models per tier require frozen nested model-within-tier factor","judge_overlap":"record generator-judge family overlap and run family-disjoint sensitivity when feasible","margins":"no noninferiority or minimum-gain margin may be invented after outcomes; estimation only until accountable margins are frozen","sampling":"confirmatory N simulated from pilot concept clustering, event rates, failures, repetitions and multiplicity"},
  "leakage_controls":["withhold same-item HPO translation and HPO-derived lineage from all generators","fresh isolated context per call and no cross-cell memory","identical prompt semantics and evidence bundle across tiers","development-only prompt adaptation with equal frozen budget","record likely pretraining contamination","held-out recent concepts and temporal replay sensitivity","deduplicate candidate text but retain every call"],
  "non_estimability":["missing tier blocks the four-tier contrast","unavailable or prohibited evidence makes paired evidence effect non-estimable","no model or source substitution after unblinding","endpoint prompt evidence or model drift invalidates the run"],
  "controls":{"payload_use_authorized":false,"empirical_execution_authorized":false,"automatic_promotion":false,"agents_grant_rights_community_ethics_or_promotion":false,"new_freeze_required":true,"maintainer_promotion_decision_required":true}
}
